root@COMP3134:~# tcpdump -A -i eth0
tcpdump: verbose output suppressed, use -v[v]... for full protocol decode
listening on eth0, link-type EN10MB (Ethernet), snapshot length 262144 bytes
00:02:29.346203 IP COMP3134.ssh > 162.243.188.66.26662: Flags [P.], seq 457369686:457369814, ack 3798851278, win 501, options [nop,nop,TS val 2184129923 ecr 793262812], length 128
E.....@.@..........B..h&.B.V.m.......@.....
./-./H:.
.Yu.-4..e".[.k..c....2.....i...i.}2.....V.)....^...y..,.>s..O.o..;T.k>..`.#....R...Q9.,<..G.Z.N.y....S?...V.,..!1t2I.&..M        .....
00:02:29.346319 IP COMP3134.ssh > 162.243.188.66.26662: Flags [P.], seq 128:272, ack 1, win 501, options [nop,nop,TS val 2184129923 ecr 793262812], length 144
E.....@.@..........B..h&.B...m.......P.....
./-./H:.)..
.._3lz  ..2...;.h....l.[eW]{D......A.....!....I.<".X</vM.......Jmx......[...H..b[=...O..c{..kn..H|*.4......F....'../....ZC^...I.%..1.*..V.@..
00:02:29.346375 IP COMP3134.ssh > 162.243.188.66.26662: Flags [P.], seq 272:352, ack 1, win 501, options [nop,nop,TS val 2184129923 ecr 793262812], length 80
E.....@.@..B.......B..h&.B.f.m.............
./-./H:..
.<T....:.8.,.......@.s1.JX.z.a?..n...h......8..h.4.......sT.h.  .. `.LS.+......
00:02:29.346421 IP COMP3134.ssh > 162.243.188.66.26662: Flags [P.], seq 352:432, ack 1, win 501, options [nop,nop,TS val 2184129923 ecr 793262812], length 80
E.....@.@..A.......B..h&.B...m.............
./-./H:.9.|s.           .W)(..M.....9...j....Lk.5.:j._#.+.~.`m.................-.\-$..:.d@iI.$...
00:02:29.346481 IP COMP3134.ssh > 162.243.188.66.26662: Flags [P.], seq 432:496, ack 1, win 501, options [nop,nop,TS val 2184129923 ecr 793262812], length 64
E..t..@.@..P.......B..h&.B...m.............
./-./H:.&E........P.aq..!.....'DI..N:y..}H.....!G)..[.......Q(.....}.
76
00:02:29.356989 IP 162.243.188.66.26662 > COMP3134.ssh: Flags [.], ack 0, win 1478, options [nop,nop,TS val 793262843 ecr 2184129912], length 0
E..4e.@.6......B....h&...m...B.V....(a.....
/H:../-x
00:02:29.364617 IP 162.243.188.66.26662 > COMP3134.ssh: Flags [.], ack 128, win 1500, options [nop,nop,TS val 793262854 ecr 2184129923], length 0
E..4e.@.6......B....h&...m...B......'......
/H;../-.
00:02:29.364618 IP 162.243.188.66.26662 > COMP3134.ssh: Flags [.], ack 272, win 1523, options [nop,nop,TS val 793262854 ecr 2184129923], length 0
E..4e.@.6......B....h&...m...B.f....'......
/H;../-.
00:02:29.364618 IP 162.243.188.66.26662 > COMP3134.ssh: Flags [.], ack 352, win 1523, options [nop,nop,TS val 793262854 ecr 2184129923], length 0
E..4e.@.6......B....h&...m...B......&......
/H;../-.
00:02:29.364618 IP 162.243.188.66.26662 > COMP3134.ssh: Flags [.], ack 432, win 1523, options [nop,nop,TS val 793262854 ecr 2184129923], length 0
E..4e.@.6......B....h&...m...B......&n.....
/H;../-.
00:02:29.364618 IP 162.243.188.66.26662 > COMP3134.ssh: Flags [.], ack 496, win 1523, options [nop,nop,TS val 793262854 ecr 2184129923], length 0
E..4e.@.6......B....h&...m...B.F....&......
/H;../-.
00:02:29.447729 IP COMP3134.51659 > 67.207.67.2.domain: 29072+ PTR? 66.188.243.162.in-addr.arpa. (45)
E..I5...@..u....C.C....5.5){q............66.188.243.162.in-addr.arpa.....
00:02:29.447891 IP COMP3134.50039 > 67.207.67.2.domain: 10343+ [1au] PTR? 66.188.243.162.in-addr.arpa. (56)
E..T.z..@.X.....C.C..w.5.@).(g...........66.188.243.162.in-addr.arpa.......)........
00:02:29.447958 IP COMP3134.47892 > 67.207.67.2.domain: Flags [S], seq 2251155184, win 64240, options [mss 1460,sackOK,TS val 3050738250 ecr 0,nop,wscale 7,tfo  cookiereq,nop,nop], length 0
E..@[.@.@..k....C.C....5.-..........)g.........
...J........"...
00:02:29.461268 IP 67.207.67.2.domain > COMP3134.51659: 29072 NXDomain 0/1/0 (112)
E...^...<..zC.C......5...x..q............66.188.243.162.in-addr.arpa..............,.7.ns1.digitalocean.com.
hostmaster..Y..U..*0.....       :.....
00:02:29.461268 IP 67.207.67.2.domain > COMP3134.50039: 10343 NXDomain 0/1/1 (123)
E...^...<..nC.C......5.w../}(g...........66.188.243.162.in-addr.arpa................7.ns1.digitalocean.com.
hostmaster..Y..U..*0.....       :.......)........
00:02:29.461269 IP 67.207.67.2.domain > COMP3134.47892: Flags [S.], seq 3440748758, ack 2251155185, win 65160, options [mss 1460,sackOK,TS val 4275430247 ecr 3050738250,nop,wscale 9], length 0
E..<..@.<...C.C......5.......-......W|.........
...g...J...
00:02:29.461378 IP COMP3134.47892 > 67.207.67.2.domain: Flags [.], ack 1, win 502, options [nop,nop,TS val 3050738263 ecr 4275430247], length 0
E..4[.@.@..v....C.C....5.-..........)[.....
...W...g
00:02:29.461600 IP COMP3134.47892 > 67.207.67.2.domain: Flags [P.], seq 1:48, ack 1, win 502, options [nop,nop,TS val 3050738263 ecr 4275430247], length 47 2071+ PTR? 66.188.243.162.in-addr.arpa. (45)
E..c[.@.@..F....C.C....5.-..........)......
...W...g.-.............66.188.243.162.in-addr.arpa.....
00:02:29.461674 IP COMP3134.50039 > 67.207.67.2.domain: 10343+ PTR? 66.188.243.162.in-addr.arpa. (45)
E..I.{..@.X.....C.C..w.5.5){(g...........66.188.243.162.in-addr.arpa.....
00:02:29.462607 IP 67.207.67.2.domain > COMP3134.47892: Flags [.], ack 48, win 128, options [nop,nop,TS val 4275430261 ecr 3050738263], length 0
E..4%+@.<..dC.C......5.......-. .....   .....
...u...W
00:02:29.462674 IP 67.207.67.2.domain > COMP3134.50039: 10343 NXDomain 0/1/0 (112)
E...^...<..vC.C......5.w.x2.(g...........66.188.243.162.in-addr.arpa..............,.7.ns1.digitalocean.com.
hostmaster..Y..U..*0.....       :.....
00:02:29.463388 IP 67.207.67.2.domain > COMP3134.47892: Flags [P.], seq 1:115, ack 48, win 128, options [nop,nop,TS val 4275430262 ecr 3050738263], length 114 2071 NXDomain 0/1/0 (112)
E...%,@.<...C.C......5.......-. ...........
...v...W.p.............66.188.243.162.in-addr.arpa..............,.7.ns1.digitalocean.com.
hostmaster..Y..U..*0.....       :.....
00:02:29.463417 IP COMP3134.47892 > 67.207.67.2.domain: Flags [.], ack 115, win 502, options [nop,nop,TS val 3050738265 ecr 4275430262], length 0
E..4[.@.@..t....C.C....5.-. ...I....)[.....
...Y...v
00:02:29.464164 IP COMP3134.55129 > 67.207.67.2.domain: 19671+ [1au] PTR? 226.239.128.178.in-addr.arpa. (57)
E..U.2..@.`1....C.C..Y.5.A).L............226.239.128.178.in-addr.arpa.......)........
00:02:29.465287 IP 67.207.67.2.domain > COMP3134.55129: 19671 NXDomain 0/1/1 (124)
E...^...<..iC.C......5.Y....L............226.239.128.178.in-addr.arpa..............2.7.ns1.digitalocean.com.
hostmaster..g._...*0.....       :.......)........
00:02:29.465408 IP COMP3134.55129 > 67.207.67.2.domain: 19671+ PTR? 226.239.128.178.in-addr.arpa. (46)
E..J.3..@.`;....C.C..Y.5.6)|L............226.239.128.178.in-addr.arpa.....
00:02:29.466517 IP 67.207.67.2.domain > COMP3134.55129: 19671 NXDomain 0/1/0 (113)
E...^...<..sC.C......5.Y.y..L............226.239.128.178.in-addr.arpa..............2.7.ns1.digitalocean.com.
hostmaster..g._...*0.....       :.....
00:02:29.467456 IP COMP3134.ssh > 162.243.188.66.26662: Flags [P.], seq 496:3360, ack 1, win 501, options [nop,nop,TS val 2184130044 ecr 793262854], length 2864
E..d..@.@.._.......B..h&.B.F.m.............
./-./H;..m...i.[..8...%..k.j;...-C.....Q.M....6Cj7.....|...x.......<&U.Ai0..oH...jj..Ja.Rl..K.W..V..6&......\o..A....w..X....}..$..........)l...7/.x;..j. 1.....}........Ia...LX.&..^.6.....D.!..I(.Z.....6@....7Y.....)..RO.C.%^.e.7.,_l.......#IC.H.......#-.........s.
..././......:.Tg...+.....Cgy....K.....K..a.2..f.........Z..=o@..Vx.D.E..........d..P#B;.>.P.`..<..B.m.?Ed.:...( .H....H..O......E.....g......J,....?_...@......g....i.(..'...~{..v..>.G6.......8jE.q.n.r..2QU..\.y39|.I..]z.`.._./...D|.[l5..c.....<.+0b...h... .r.X|.S._`.9.X...#<..ARDXP.7d..$..V........h......C)...E.L..... 4....-..c..l....+.).[...s....w.L :........Up....Y..X...:......u.H.....2|B.h.R|.g......W.R....U.5...(k..........0....g?0..y.O.>.yE..H...dm./?..Q.v...2...Y.4Z.......j.yY..wV".......p....e.o.......26.#Y'..4-..n......Q......l:..'F...c.{..R..A..aV.<u.-. w...AK.F.Cy.=<.........R.....9......qV.7..hC....aw..}..m.k.....uk..;....~.......i.$...D....0....D....k .........n.....`O..5R.bd.|M...Jf........aC..Opl.P1.4..o0..F.lo.C-.pA.I.`..F <.....&.......?......H"\^.)&3......e...$."..Us.L...A4.]b...7ru...NX...y.na.+....bV..E..a..."       .....}c.>....w>9S.SS-.,..EH0.Q..\S.N....$.?k..#.v....r.....\B....`.d..a.|..K..^.....@...'.S.d.l..-.}a..  p.O....o....r...qY....l....X.Z.."..%..(..uc.0.B....R..J~...c.XIC..z.......       ...l.d....R.[..U<E/...0sX..g......:.u&j..=.o.v...B....................EA....,.4.E._c.. .....u...+.fX(..........I...8....R.......~.....1.H...#...U.$.n].W.V......1......:f..Ke....#..p..y.zF..F..b..d[.5.n....dy'...3>Hh....=R..Z..~......f..Z.H.....YO...z.{.gV%`P.*f..~....".V..L..KqV#sz.@b..q............F.li....|...M....B.q.s.....-j.&..)....2}l..:.B.>......(....y&9&i.O..9.5..m.....:.a..E...5......D.xw...~.vI.M3.....'..h..u..~:...Xus...s.r.\......Nd22.I......1...2.5.....W..gG.G.FS.U.....:.zYkG.4.'........"@...&N."}..9.      ..w...b#..[.k.....2j..N.....A.l7>.........J........0&..R..r...k..o.XJ    ...z.......:%..Y...f.....>.&.]...:N..\(..zY1........:1.B...z.q.b..8....-pQZ.f..D....a....fm..4.p.~.'.........nW.`..S.....L......'..F..#@.'ZK.I...p..Z..!.{.Wq3.w1..C..V?W......G..&@...z..G...q=s..$....q...x..VL......z8,...a........./H.r.B.....X.0.U.W.@....^.U......d..B.!Rv{.=.../...#..$gR6^A...S..i..7M......R.7    ..bO[.o......0...;/....7.||.f.9JM.E...M........VB.zQK..3..7x.L....|.h.l...S....).|..:....pRy'....{%...E4C....F..j.....#.a...A....wz....:.....YZ5cF.
.....`m..M0.j,...G.ztS..k.C.;..Fg....;.o8..%(I.....X..h./4...=..V.18%....*q..@....U..[.).].N.. .T.?.....R........w.A.W.S..:....j.A..5.}....`.....I..g...K..).T.u......Z..c.'........=/.  ....!T..'w.D..[.p>m..Jp..,..*....8pW4... S?9...].@[g..Z..}...E..]..I.H6.g..xj*..E.O.bD.~..'.A..K.......,c...T.v....-.....[.`.l..n....'../D.}. ..q.\...z...@..q`F....v7..*..6Z<Fw.J......F5.0:.#..dy...*....+...........~.*....O.&\....[......Y......t.z..V.. ._.;.........\..u..yl.......>J.y.l\.....2.&...,....;.V.aR...V....Uv.(...i...V......(.....z...t...a.
00:02:29.485894 IP 162.243.188.66.26662 > COMP3134.ssh: Flags [.], ack 3360, win 1568, options [nop,nop,TS val 793262976 ecr 2184130044], length 0
E..4e.@.6......B....h&...m...B.v... .......
/H;../-.
^C
30 packets captured
51 packets received by filter
0 packets dropped by kernel